{
  "schema_version": "narration-manifest/2.0",
  "edition_id": "10000000-0000-4000-8000-000000000001",
  "chapter_id": "10000000-0000-4000-8000-000000000002",
  "source_revision_id": "10000000-0000-4000-8000-000000000003",
  "source_sha256": "aaaaaaaaaaaaaaaaaaaaaaaaaaaaaaaaaaaaaaaaaaaaaaaaaaaaaaaaaaaaaaaa",
  "buffer_policy": {
    "version": "initial-buffer/v1-3-segments-8000ms",
    "minimum_segments": 3,
    "minimum_duration_ms": 8000,
    "target_segments": 5,
    "chapter_end_exception": true
  },
  "manifest_revision": 4,
  "etag": "\"364aca770ad453baafb24b0193e0a44ea0aa1887c63be073cf03401ca4dab2fe\"",
  "generated_at": "2026-08-27T08:00:00Z",
  "status": "partial_ready",
  "ready_prefix_count": 3,
  "default_start_ready": true,
  "last_playable_start_ordinal": 0,
  "ready_ranges": [
    {
      "start_ordinal": 0,
      "end_ordinal_exclusive": 3,
      "segment_count": 3,
      "duration_ms": 9500,
      "last_playable_start_ordinal": 0
    }
  ],
  "segments": [
    {
      "segment_id": "10000000-0000-4000-8000-000000000010",
      "ordinal": 0,
      "paragraph_ordinal": 0,
      "source_block_key": "sb1_4444444444444444444444444444444444444444444444444444444444444444",
      "source_start_utf16": 0,
      "source_end_utf16": 8,
      "gap_after_ms": 250,
      "render_status": "ready",
      "audio": {
        "url": "/api/ai-novel-world-2026/media-assets/20000000-0000-4000-8000-000000000020/content",
        "actual_sha256": "1111111111111111111111111111111111111111111111111111111111111111",
        "duration_ms": 3000,
        "sample_rate": 48000,
        "channels": 2,
        "etag": "\"1111111111111111111111111111111111111111111111111111111111111111\""
      },
      "failure": null
    },
    {
      "segment_id": "10000000-0000-4000-8000-000000000011",
      "ordinal": 1,
      "paragraph_ordinal": 1,
      "source_block_key": "sb1_5555555555555555555555555555555555555555555555555555555555555555",
      "source_start_utf16": 0,
      "source_end_utf16": 8,
      "gap_after_ms": 250,
      "render_status": "ready",
      "audio": {
        "url": "/api/ai-novel-world-2026/media-assets/20000000-0000-4000-8000-000000000021/content",
        "actual_sha256": "2222222222222222222222222222222222222222222222222222222222222222",
        "duration_ms": 3000,
        "sample_rate": 48000,
        "channels": 2,
        "etag": "\"2222222222222222222222222222222222222222222222222222222222222222\""
      },
      "failure": null
    },
    {
      "segment_id": "10000000-0000-4000-8000-000000000012",
      "ordinal": 2,
      "paragraph_ordinal": 2,
      "source_block_key": "sb1_6666666666666666666666666666666666666666666666666666666666666666",
      "source_start_utf16": 0,
      "source_end_utf16": 8,
      "gap_after_ms": 250,
      "render_status": "ready",
      "audio": {
        "url": "/api/ai-novel-world-2026/media-assets/20000000-0000-4000-8000-000000000022/content",
        "actual_sha256": "3333333333333333333333333333333333333333333333333333333333333333",
        "duration_ms": 3000,
        "sample_rate": 48000,
        "channels": 2,
        "etag": "\"3333333333333333333333333333333333333333333333333333333333333333\""
      },
      "failure": null
    },
    {
      "segment_id": "10000000-0000-4000-8000-000000000013",
      "ordinal": 3,
      "paragraph_ordinal": 3,
      "source_block_key": "sb1_7777777777777777777777777777777777777777777777777777777777777777",
      "source_start_utf16": 0,
      "source_end_utf16": 8,
      "gap_after_ms": 250,
      "render_status": "pending",
      "audio": null,
      "failure": null
    },
    {
      "segment_id": "10000000-0000-4000-8000-000000000014",
      "ordinal": 4,
      "paragraph_ordinal": 4,
      "source_block_key": "sb1_8888888888888888888888888888888888888888888888888888888888888888",
      "source_start_utf16": 0,
      "source_end_utf16": 8,
      "gap_after_ms": 250,
      "render_status": "pending",
      "audio": null,
      "failure": null
    }
  ]
}
